{
  "schema_version": "1.0.0",
  "asset_repository": "sword-assets",
  "asset_commit": "a6bc3a7e45920c5d3690b7b19669c2603fdf1004",
  "manifests": [
    {
      "path": "manifests/art/chapter_01_li_xiaoyao.v1.json",
      "sha256": "3821ee9c1205df207647f53370b3b681e639e92b7809c2572fb6166ed45fefe8"
    },
    {
      "path": "manifests/art/chapter_01_map_012.v1.json",
      "sha256": "defc22cc1f417cbb91dac8aaab909e95ae818c27aa42dc5b127fd30ef3e67bc8"
    },
    {
      "path": "manifests/remaster/chapter_01_map_012.v1.json",
      "sha256": "d7279591801811f27e013dc75e38ed49b6dc241cc76785ebe5761004610a6586"
    }
  ]
}
